{
  "match_id": "M30",
  "round": "GRP",
  "kickoff_utc": "2026-06-19T00:00:00Z",
  "home": {
    "fifa_code": "SCO",
    "display_name": "Scotland"
  },
  "away": {
    "fifa_code": "MAR",
    "display_name": "Morocco"
  },
  "p_model_1x2": {
    "H": 0.251118,
    "D": 0.212,
    "A": 0.536882
  },
  "p_model_goals": [
    [
      0.090718,
      0.128819,
      0.091462,
      0.043292,
      0.015369,
      0.004365,
      0.001033,
      0.00021,
      0.000037,
      0.000006,
      0.000001
    ],
    [
      0.088904,
      0.126243,
      0.089633,
      0.042426,
      0.015061,
      0.004277,
      0.001012,
      0.000205,
      0.000036,
      0.000006,
      0.000001
    ],
    [
      0.043563,
      0.061859,
      0.04392,
      0.020789,
      0.00738,
      0.002096,
      0.000496,
      0.000101,
      0.000018,
      0.000003,
      0
    ],
    [
      0.014231,
      0.020207,
      0.014347,
      0.006791,
      0.002411,
      0.000685,
      0.000162,
      0.000033,
      0.000006,
      0.000001,
      0
    ],
    [
      0.003486,
      0.004951,
      0.003515,
      0.001664,
      0.000591,
      0.000168,
      0.00004,
      0.000008,
      0.000001,
      0,
      0
    ],
    [
      0.000683,
      0.00097,
      0.000689,
      0.000326,
      0.000116,
      0.000033,
      0.000008,
      0.000002,
      0,
      0,
      0
    ],
    [
      0.000112,
      0.000158,
      0.000113,
      0.000053,
      0.000019,
      0.000005,
      0.000001,
      0,
      0,
      0,
      0
    ],
    [
      0.000016,
      0.000022,
      0.000016,
      0.000007,
      0.000003,
      0.000001,
      0,
      0,
      0,
      0,
      0
    ],
    [
      0.000002,
      0.000003,
      0.000002,
      0.000001,
      0,
      0,
      0,
      0,
      0,
      0,
      0
    ],
    [
      0,
      0,
      0,
      0,
      0,
      0,
      0,
      0,
      0,
      0,
      0
    ],
    [
      0,
      0,
      0,
      0,
      0,
      0,
      0,
      0,
      0,
      0,
      0
    ]
  ],
  "lambda": {
    "home": 0.98,
    "away": 1.42,
    "rho": -0.05
  },
  "shootout_applicable": false,
  "p_shootout_home_if_ko": null,
  "market_divergence": [],
  "strength_inputs": {
    "elo_home": 1700,
    "elo_away": 1832,
    "form_home": 0,
    "form_away": 0,
    "fifa_rank_home": 0,
    "fifa_rank_away": 0
  },
  "forecast_ids": []
}
