{
  "match_id": "M22",
  "round": "GRP",
  "kickoff_utc": "2026-06-17T23:00:00+00:00",
  "home": {
    "fifa_code": "UZB",
    "display_name": "Uzbekistan"
  },
  "away": {
    "fifa_code": "COL",
    "display_name": "Colombia"
  },
  "p_model_1x2": {
    "H": 0.166206,
    "D": 0.186937,
    "A": 0.646856
  },
  "p_model_goals": [
    [
      0.02680835,
      0.05402294,
      0.07065127,
      0.05791091,
      0.03560098,
      0.01750869,
      0.0071757,
      0.00252074,
      0.00077482,
      0.0002117,
      5.206e-05
    ],
    [
      0.02453917,
      0.07469518,
      0.09033828,
      0.07640284,
      0.04841676,
      0.02452355,
      0.01034245,
      0.00373569,
      0.00117978,
      0.00033095,
      8.35e-05
    ],
    [
      0.01675001,
      0.04398649,
      0.05763869,
      0.05025613,
      0.03280525,
      0.01710207,
      0.00741777,
      0.00275353,
      0.00089307,
      0.00025712,
      6.653e-05
    ],
    [
      0.00668502,
      0.01811359,
      0.02447015,
      0.0219788,
      0.01476796,
      0.00791904,
      0.00353054,
      0.00134621,
      0.00044821,
      0.00013239,
      3.512e-05
    ],
    [
      0.00200102,
      0.00558905,
      0.00777747,
      0.00719065,
      0.00496995,
      0.0027396,
      0.00125477,
      0.00049122,
      0.00016782,
      5.083e-05,
      1.382e-05
    ],
    [
      0.00047917,
      0.00137839,
      0.0019742,
      0.00187745,
      0.00133394,
      0.00075543,
      0.00035526,
      0.00014273,
      5.001e-05,
      1.553e-05,
      4.33e-06
    ],
    [
      9.562e-05,
      0.00028305,
      0.00041693,
      0.00040755,
      0.00029748,
      0.00017298,
      8.348e-05,
      3.44e-05,
      1.236e-05,
      3.93e-06,
      1.12e-06
    ],
    [
      1.636e-05,
      4.978e-05,
      7.536e-05,
      7.567e-05,
      5.67e-05,
      3.384e-05,
      1.675e-05,
      7.08e-06,
      2.61e-06,
      8.5e-07,
      2.5e-07
    ],
    [
      2.45e-06,
      7.65e-06,
      1.19e-05,
      1.227e-05,
      9.43e-06,
      5.77e-06,
      2.93e-06,
      1.27e-06,
      4.8e-07,
      1.6e-07,
      5e-08
    ],
    [
      3.3e-07,
      1.05e-06,
      1.67e-06,
      1.76e-06,
      1.39e-06,
      8.7e-07,
      4.5e-07,
      2e-07,
      8e-08,
      3e-08,
      1e-08
    ],
    [
      4e-08,
      1.3e-07,
      2.1e-07,
      2.3e-07,
      1.8e-07,
      1.2e-07,
      6e-08,
      3e-08,
      1e-08,
      0.0,
      0.0
    ]
  ],
  "lambda": {
    "home": 1.197317,
    "away": 2.459018,
    "rho": -0.05
  },
  "shootout_applicable": false,
  "p_shootout_home_if_ko": null,
  "market_divergence": [],
  "strength_inputs": {
    "elo_home": 1727.0,
    "elo_away": 1975.0,
    "form_home": 0.0,
    "form_away": 0.0,
    "fifa_rank_home": 0,
    "fifa_rank_away": 0
  },
  "forecast_ids": []
}