{
  "match_id": "M33",
  "round": "GRP",
  "kickoff_utc": "2026-06-19T17:00:00Z",
  "home": {
    "fifa_code": "GER",
    "display_name": "Germany"
  },
  "away": {
    "fifa_code": "CIV",
    "display_name": "Côte d'Ivoire"
  },
  "p_model_1x2": {
    "H": 0.6827,
    "D": 0.16,
    "A": 0.1573
  },
  "p_model_goals": [
    [
      0.090718,
      0.070306,
      0.027244,
      0.007038,
      0.001364,
      0.000211,
      0.000027,
      0.000003,
      0,
      0,
      0
    ],
    [
      0.147417,
      0.114248,
      0.044271,
      0.011437,
      0.002216,
      0.000343,
      0.000044,
      0.000005,
      0,
      0,
      0
    ],
    [
      0.119776,
      0.092826,
      0.03597,
      0.009292,
      0.0018,
      0.000279,
      0.000036,
      0.000004,
      0,
      0,
      0
    ],
    [
      0.064879,
      0.050281,
      0.019484,
      0.005033,
      0.000975,
      0.000151,
      0.00002,
      0.000002,
      0,
      0,
      0
    ],
    [
      0.026357,
      0.020427,
      0.007915,
      0.002045,
      0.000396,
      0.000061,
      0.000008,
      0.000001,
      0,
      0,
      0
    ],
    [
      0.008566,
      0.006639,
      0.002572,
      0.000665,
      0.000129,
      0.00002,
      0.000003,
      0,
      0,
      0,
      0
    ],
    [
      0.00232,
      0.001798,
      0.000697,
      0.00018,
      0.000035,
      0.000005,
      0.000001,
      0,
      0,
      0,
      0
    ],
    [
      0.000539,
      0.000417,
      0.000162,
      0.000042,
      0.000008,
      0.000001,
      0,
      0,
      0,
      0,
      0
    ],
    [
      0.000109,
      0.000085,
      0.000033,
      0.000008,
      0.000002,
      0,
      0,
      0,
      0,
      0,
      0
    ],
    [
      0.00002,
      0.000015,
      0.000006,
      0.000002,
      0,
      0,
      0,
      0,
      0,
      0,
      0
    ],
    [
      0.000003,
      0.000002,
      0.000001,
      0,
      0,
      0,
      0,
      0,
      0,
      0,
      0
    ]
  ],
  "lambda": {
    "home": 1.625,
    "away": 0.775,
    "rho": -0.05
  },
  "shootout_applicable": false,
  "p_shootout_home_if_ko": null,
  "market_divergence": [],
  "strength_inputs": {
    "elo_home": 1990,
    "elo_away": 1735,
    "form_home": 0,
    "form_away": 0,
    "fifa_rank_home": 0,
    "fifa_rank_away": 0
  },
  "forecast_ids": []
}
