{
  "match_id": "2026-06-22_Ukraine_Jordan",
  "round": "GRP",
  "kickoff_utc": "2026-06-22T21:00:00+00:00",
  "home": {
    "fifa_code": "UKR",
    "display_name": "Ukraine"
  },
  "away": {
    "fifa_code": "JOR",
    "display_name": "Jordan"
  },
  "p_model_1x2": {
    "H": 0.464347,
    "D": 0.229024,
    "A": 0.306629
  },
  "p_model_goals": [
    [
      0.03284396,
      0.03971696,
      0.03370625,
      0.01724064,
      0.0066139,
      0.00202979,
      0.00051912,
      0.0001138,
      2.183e-05,
      3.72e-06,
      5.7e-07
    ],
    [
      0.0507166,
      0.091512,
      0.06906528,
      0.03645021,
      0.01441414,
      0.00455595,
      0.00119901,
      0.00027025,
      5.326e-05,
      9.32e-06,
      1.47e-06
    ],
    [
      0.05269816,
      0.08635794,
      0.07061542,
      0.03842174,
      0.0156507,
      0.00509145,
      0.00137806,
      0.00031922,
      6.461e-05,
      1.161e-05,
      1.87e-06
    ],
    [
      0.03370396,
      0.05698821,
      0.04804182,
      0.02692708,
      0.01129038,
      0.00377801,
      0.00105108,
      0.0002501,
      5.196e-05,
      9.58e-06,
      1.59e-06
    ],
    [
      0.01616693,
      0.02817839,
      0.02446914,
      0.01411728,
      0.00608889,
      0.00209447,
      0.00059863,
      0.00014624,
      3.118e-05,
      5.89e-06,
      1e-06
    ],
    [
      0.00620389,
      0.0111365,
      0.00995335,
      0.00590674,
      0.00261889,
      0.00092551,
      0.00027161,
      6.809e-05,
      1.489e-05,
      2.88e-06,
      5e-07
    ],
    [
      0.0019839,
      0.00366466,
      0.00336852,
      0.00205477,
      0.00093592,
      0.00033961,
      0.00010228,
      2.63e-05,
      5.9e-06,
      1.17e-06,
      2.1e-07
    ],
    [
      0.00054379,
      0.00103282,
      0.00097566,
      0.00061133,
      0.00028589,
      0.00010646,
      3.289e-05,
      8.67e-06,
      1.99e-06,
      4.1e-07,
      7e-08
    ],
    [
      0.00013042,
      0.00025451,
      0.00024691,
      0.00015882,
      7.621e-05,
      2.911e-05,
      9.22e-06,
      2.49e-06,
      5.9e-07,
      1.2e-07,
      2e-08
    ],
    [
      2.78e-05,
      5.571e-05,
      5.547e-05,
      3.66e-05,
      1.801e-05,
      7.05e-06,
      2.29e-06,
      6.3e-07,
      1.5e-07,
      3e-08,
      1e-08
    ],
    [
      5.33e-06,
      1.097e-05,
      1.12e-05,
      7.58e-06,
      3.82e-06,
      1.53e-06,
      5.1e-07,
      1.4e-07,
      4e-08,
      1e-08,
      0.0
    ]
  ],
  "lambda": {
    "home": 1.918698,
    "away": 1.53449,
    "rho": -0.05
  },
  "shootout_applicable": false,
  "p_shootout_home_if_ko": null,
  "market_divergence": [],
  "strength_inputs": {
    "elo_home": 1767.0,
    "elo_away": 1690.0,
    "form_home": 0.0,
    "form_away": 0.0,
    "fifa_rank_home": 0,
    "fifa_rank_away": 0
  },
  "forecast_ids": []
}