{
  "match_id": "M54",
  "round": "GRP",
  "kickoff_utc": "2026-06-24T00:00:00Z",
  "home": {
    "fifa_code": "MAR",
    "display_name": "Morocco"
  },
  "away": {
    "fifa_code": "HAI",
    "display_name": "Haiti"
  },
  "p_model_1x2": {
    "H": 0.764432,
    "D": 0.16,
    "A": 0.075568
  },
  "p_model_goals": [
    [
      0.090718,
      0.048081,
      0.012741,
      0.002251,
      0.000298,
      0.000032,
      0.000003,
      0,
      0,
      0,
      0
    ],
    [
      0.169643,
      0.089911,
      0.023826,
      0.004209,
      0.000558,
      0.000059,
      0.000005,
      0,
      0,
      0,
      0
    ],
    [
      0.158616,
      0.084066,
      0.022278,
      0.003936,
      0.000521,
      0.000055,
      0.000005,
      0,
      0,
      0,
      0
    ],
    [
      0.098871,
      0.052401,
      0.013886,
      0.002453,
      0.000325,
      0.000034,
      0.000003,
      0,
      0,
      0,
      0
    ],
    [
      0.046222,
      0.024498,
      0.006492,
      0.001147,
      0.000152,
      0.000016,
      0.000001,
      0,
      0,
      0,
      0
    ],
    [
      0.017287,
      0.009162,
      0.002428,
      0.000429,
      0.000057,
      0.000006,
      0.000001,
      0,
      0,
      0,
      0
    ],
    [
      0.005388,
      0.002856,
      0.000757,
      0.000134,
      0.000018,
      0.000002,
      0,
      0,
      0,
      0,
      0
    ],
    [
      0.001439,
      0.000763,
      0.000202,
      0.000036,
      0.000005,
      0.000001,
      0,
      0,
      0,
      0,
      0
    ],
    [
      0.000336,
      0.000178,
      0.000047,
      0.000008,
      0.000001,
      0,
      0,
      0,
      0,
      0,
      0
    ],
    [
      0.00007,
      0.000037,
      0.00001,
      0.000002,
      0,
      0,
      0,
      0,
      0,
      0,
      0
    ],
    [
      0.000013,
      0.000007,
      0.000002,
      0,
      0,
      0,
      0,
      0,
      0,
      0,
      0
    ]
  ],
  "lambda": {
    "home": 1.87,
    "away": 0.53,
    "rho": -0.05
  },
  "shootout_applicable": false,
  "p_shootout_home_if_ko": null,
  "market_divergence": [],
  "strength_inputs": {
    "elo_home": 1832,
    "elo_away": 1430,
    "form_home": 0,
    "form_away": 0,
    "fifa_rank_home": 0,
    "fifa_rank_away": 0
  },
  "forecast_ids": []
}
